{
  "schema_version": "2.1.0",
  "build": {
    "build_id": "ASK-B-238A8918C7",
    "build_version": "2.1.0",
    "mode": "template_locked",
    "seed": 41027,
    "topic_id": "massive_hemorrhage",
    "retriever_track": "hybrid_cc_loto",
    "blueprint_id": "ASK-BP-FIELD-001",
    "source_scenario_id": "ASK-A-001",
    "source_bridge_schema": "2.0.0",
    "source_database_sha256": "5ef6ab73f8a546ffbc2f5db2588113e70b9faa3ac811f171e8b39a132586907e",
    "source_bridge_sha256": "f7782ee749e19ed54d52a308f20a74227a821c3a29ea409b2bd5ca55d8bed338",
    "source_prototype_id": "research-massive_hemorrhage-e826d2405d3ef112-hybrid_cc_loto",
    "source_prototype_sha256": "0631653cc8ef6a7d169792e063e665bec1688917ac7b12cade0e5101b9de8eeb",
    "source_prototype_record_sha256": "045dba1c4c326e41841f1cc1e6414afd40f9e23b1c403d362fabf16a61d5b424"
  },
  "blueprint": {
    "blueprint_id": "ASK-BP-FIELD-001",
    "blueprint_version": "1.1.0",
    "mode": "template_locked",
    "source_scenario_id": "ASK-A-001",
    "allowed_topics": [
      "massive_hemorrhage",
      "airway",
      "respiration_chest",
      "evacuation_transport",
      "documentation_aar"
    ],
    "mutable_paths": [
      "scenario.scenario_id",
      "scenario.title",
      "scenario.version",
      "scenario.fictionalization_notice",
      "scenario.operational_context.location_type",
      "scenario.operational_context.weather",
      "scenario.operational_context.visibility",
      "scenario.operational_context.comms_status",
      "scenario.operational_context.resource_status",
      "scenario.operational_context.narrative"
    ],
    "location_options": [
      "flightline maintenance lane",
      "aircraft shelter access road",
      "logistics staging apron",
      "damaged operations perimeter"
    ],
    "weather_options": [
      "clear with cold crosswind",
      "light rain with standing water",
      "cold wind with intermittent smoke",
      "dry conditions with reduced visibility"
    ],
    "visibility_options": [
      "Good",
      "Variable",
      "Reduced"
    ],
    "communications_options": [
      "degraded",
      "intermittent",
      "unavailable"
    ],
    "resource_options": [
      "constrained",
      "overwhelmed"
    ],
    "resource_event_options": [
      "transport route changes while the team prepares handoff",
      "communications become intermittent during casualty movement",
      "a second response task temporarily reduces available personnel",
      "equipment access is delayed by a relocation order"
    ],
    "route_template_id": "ASK-ROUTE-FIELD-001"
  },
  "authority": {
    "clinical_authority": "NOT_GRANTED",
    "deployment_scope": "research_sandbox_only",
    "source_template_status": "repository_template_not_clinically_certified",
    "clinical_rule_source": "inherited_template",
    "evidence_authority": "supporting_only",
    "evidence_effect_scope": "citation_support_only",
    "scoring_behavior": "inherited_unchanged"
  },
  "scenario": {
    "scenario_id": "ASK-V-F3A6E77080",
    "title": "Flightline Fragmentation Casualty After Missile Warning — Operational Variant",
    "version": "1.0.0+variant.2.2",
    "fictionalization_notice": "Fictional training scenario. Not real medical advice. Follow local medical authority and current approved doctrine. Operational details were varied for training; the inherited clinical scaffold was not changed.",
    "operational_context": {
      "location_type": "flightline maintenance lane",
      "threat_type": "missile_attack",
      "weather": "clear with cold crosswind",
      "visibility": "Variable",
      "comms_status": "degraded",
      "resource_status": "overwhelmed",
      "narrative": "Fictional operational variant at flightline maintenance lane. Weather: clear with cold crosswind. Visibility: Variable. Communications: degraded. Resources: overwhelmed. Facilitator event: communications become intermittent during casualty movement. The clinical scaffold, action catalog, scoring, and end conditions are inherited unchanged from ASK-A-001."
    },
    "training_objectives": [
      "Assess scene safety and threat",
      "Control life-threatening hemorrhage",
      "Assess airway and breathing",
      "Request evacuation"
    ],
    "target_section": "A_field_reaction_triage_incident_response",
    "target_role": "combat_lifesaver",
    "skill_level": "intermediate",
    "difficulty": "intermediate",
    "threat_type": "missile_attack",
    "casualty_count": 1,
    "patients": [
      {
        "patient_id": "P1",
        "age_band": "25-34",
        "sex": "M",
        "role_context": "Maintenance Airman",
        "mechanism_of_injury": "Fragmentation wound from nearby blast",
        "initial_presentation": "Conscious male lying supine near equipment. Yelling in pain. Obvious bleeding from right thigh. Rapid, shallow breathing. Clutching chest but primary visible injury is lower extremity.",
        "injury_profile_refs": [
          "extremity_hemorrhage",
          "possible_chest_contusion"
        ],
        "initial_vitals": {
          "hr": 128,
          "bp_systolic": 92,
          "bp_diastolic": 58,
          "rr": 28,
          "spo2": 91,
          "temp_c": 36.2,
          "gcs": 14
        },
        "hidden_findings": [
          "Possible tension pneumothorax developing if chest injury worsens"
        ],
        "deterioration_timeline": [
          "Without hemorrhage control: BP drops within 2 minutes",
          "Without airway support if needed: SpO2 declines"
        ],
        "visible_body_zones": [
          {
            "zone": "right_thigh",
            "label": "Fragmentation / active hemorrhage",
            "severity": "visible"
          },
          {
            "zone": "chest",
            "label": "Guarding chest. Possible contusion.",
            "severity": "suspected"
          }
        ]
      }
    ],
    "expected_actions": {
      "critical": [
        {
          "id": "scene_safety",
          "label": "Assess scene safety / threat",
          "priority": "critical",
          "synonyms": [
            "scene safe",
            "threat assessment",
            "check for threats",
            "scene security",
            "cover",
            "concealment",
            "additional casualties"
          ],
          "points": 10
        },
        {
          "id": "hemorrhage_control",
          "label": "Control massive hemorrhage",
          "priority": "critical",
          "synonyms": [
            "tourniquet",
            "tq",
            "apply tourniquet",
            "stop bleeding",
            "hemorrhage control",
            "pressure dressing",
            "pack wound",
            "direct pressure"
          ],
          "points": 20,
          "marchStep": "massive_hemorrhage"
        },
        {
          "id": "airway_assessment",
          "label": "Assess and manage airway",
          "priority": "critical",
          "synonyms": [
            "airway",
            "jaw thrust",
            "recovery position",
            "nasopharyngeal",
            "npa",
            "open airway"
          ],
          "points": 15,
          "marchStep": "airway"
        },
        {
          "id": "breathing_assessment",
          "label": "Assess breathing / respiration",
          "priority": "critical",
          "synonyms": [
            "breathing",
            "respiration",
            "chest seal",
            "needle decompression",
            "check breath sounds",
            "ventilation"
          ],
          "points": 15,
          "marchStep": "respiration"
        }
      ],
      "important": [
        {
          "id": "circulation_check",
          "label": "Assess circulation / shock",
          "priority": "important",
          "synonyms": [
            "pulse",
            "circulation",
            "shock",
            "perfusion",
            "iv access"
          ],
          "points": 8,
          "marchStep": "circulation"
        },
        {
          "id": "hypothermia_prevention",
          "label": "Prevent hypothermia",
          "priority": "important",
          "synonyms": [
            "hypothermia",
            "blanket",
            "hpmk",
            "keep warm",
            "prevent heat loss"
          ],
          "points": 5,
          "marchStep": "hypothermia_head"
        },
        {
          "id": "evacuation_request",
          "label": "Request evacuation / CASEVAC",
          "priority": "important",
          "synonyms": [
            "evac",
            "evacuation",
            "casevac",
            "medevac",
            "request transport",
            "9-line",
            "call for help"
          ],
          "points": 10
        }
      ],
      "optional": [
        {
          "id": "pain_management",
          "label": "Address pain when appropriate",
          "priority": "optional",
          "synonyms": [
            "pain",
            "analgesia",
            "comfort"
          ],
          "points": 3,
          "marchStep": "pain"
        },
        {
          "id": "documentation",
          "label": "Document interventions",
          "priority": "optional",
          "synonyms": [
            "document",
            "record",
            "note",
            "tccc card"
          ],
          "points": 3
        }
      ],
      "unsafe": [
        {
          "id": "ignore_hemorrhage",
          "label": "Delay or ignore hemorrhage control",
          "priority": "unsafe",
          "synonyms": [
            "wait and see",
            "skip tourniquet",
            "bleeding will stop"
          ],
          "points": -25
        },
        {
          "id": "remove_tourniquet_early",
          "label": "Remove tourniquet without medical direction",
          "priority": "unsafe",
          "synonyms": [
            "remove tourniquet",
            "take off tourniquet"
          ],
          "points": -20